{
  "id": "self-attestation-local-dev-incomplete",
  "schema_version": "0.1.0",
  "manifest_ref": "examples/contract-foundation/contract-manifest.example.json",
  "dsse_envelope_ref": "examples/contract-foundation/contract-release.dsse.json",
  "public_key_ref": "examples/contract-foundation/local-dev-signing-public.pem",
  "trusted_identity_policy_ref": "examples/contract-foundation/trusted-identity-policy.example.json",
  "expected_source_commit": "e9cbc10f41173fa5b82fd19884eb2923491e2cb2",
  "expected_signer_identity": "local-dev-dsse-openssl-v1:e527393b7397f601451f406af8969255482e0fec6aeb650bc2d64fab8aefa188",
  "reference_time": "2026-05-01T00:00:00Z",
  "verification_artifact_ref": "examples/contract-foundation/contract-release-verification.example.json",
  "verification_artifact_sha256": "26ac41a287696248cfe375e321e06bcecd25fd995705b16c40b3a793bef59dca",
  "require_external_attestation": false,
  "expected_negative": false,
  "expected_proof_states": {
    "schema_valid": true,
    "digest_verified": true,
    "source_commit_artifacts_verified": true,
    "locally_attested": true,
    "externally_attested": null,
    "production_release_verified": null,
    "trusted_contract_release": false
  }
}
